{
  "schemaVersion": "retail-tenant-market-set/v1",
  "retailerId": "retailer-demo",
  "tenantId": "tenant-demo",
  "environment": "local",
  "governedMarkets": [
    {
      "marketId": "gulf-india",
      "operatingCurrency": "INR",
      "timezone": "Asia/Kolkata"
    }
  ],
  "reportingCurrency": "INR",
  "referenceCurrencies": ["INR", "USD", "EUR", "GBP", "AED"],
  "decisionAsOf": "2026-08-11T00:00:00Z",
  "approval": {
    "status": "approved",
    "actor": "nilay.shah",
    "approvedAt": "2026-08-11",
    "authorization": "Phase 5 implementation go-ahead for the current Gulf Oil India local audience."
  }
}
